{
  "kind": "weekend",
  "schema_version": 1,
  "id": "local.club.weekend.sprint",
  "name": "Club sprint weekend",
  "description": "File-only fourteen-car example using the club vehicle, allocation, setup and race tuning.",
  "vehicle_id": "local.club.vehicle.sport",
  "roster_id": "local.club.roster.expanded",
  "tyre_allocation_id": "local.club.tyre_allocation.endurance",
  "setup_id": "local.club.setup.club",
  "race_tuning_id": "local.club.race_tuning.sprint",
  "settings": {
    "laps": 8,
    "seed": 7314,
    "qual_duration": 480.0,
    "scenario": "dry",
    "intensity": "calm",
    "weather_mode": "scripted_training",
    "rival_styles": false,
    "tactical_duels": false
  }
}
