{
  "kind": "weekend",
  "schema_version": 1,
  "id": "core.weekend.quick",
  "name": "Quick weekend",
  "description": "Twelve racing laps with the same disclosed reference model; all approval gates remain.",
  "vehicle_id": "core.vehicle.formula",
  "roster_id": "core.roster.default",
  "tyre_allocation_id": "core.tyre_allocation.default",
  "setup_id": "core.setup.balanced",
  "race_tuning_id": "core.race_tuning.default",
  "settings": {
    "laps": 12,
    "seed": 7314,
    "qual_duration": 480.0,
    "scenario": "dry",
    "intensity": "standard",
    "weather_mode": "seeded",
    "rival_styles": true,
    "tactical_duels": true
  }
}
